{
    "schema_version": "2020-12",
    "encounter_id": "SYN_OUT_010",
    "note_id": "note_010",
    "note_format": "soap_lite",
    "overall_verification_status": "verified",
    "unsupported_claim_count": 0,
    "contradicted_claim_count": 0,
    "created_at": "2026-06-03T00:00:00+07:00",
    "created_by": "Duy",
    "version": "v0.1.0",
    "claims": [
        {
            "claim_id": "claim_001",
            "section": "S",
            "claim_text": "Bệnh nhân tái khám tăng huyết áp, đang sử dụng Amlodipine 5mg được 6 tháng",
            "claim_type": "subjective_history",
            "source_segment_ids": [
                "seg_001"
            ],
            "source_evidence": [
                {
                    "segment_id": "seg_001",
                    "start_time": 0.0,
                    "end_time": 5.0,
                    "quote": "Chú uống thuốc Amlodipine 5mg được 6 tháng rồi nhỉ."
                }
            ],
            "evidence_status": "supported",
            "verification_status": "verified",
            "risk_if_wrong": "moderate",
            "requires_doctor_confirmation": false
        },
        {
            "claim_id": "claim_002",
            "section": "S",
            "claim_text": "Huyết áp tự đo ở nhà ổn định khoảng 130/80 mmHg",
            "claim_type": "subjective_history",
            "source_segment_ids": [
                "seg_002"
            ],
            "source_evidence": [
                {
                    "segment_id": "seg_002",
                    "start_time": 5.5,
                    "end_time": 10.5,
                    "quote": "Huyết áp đo ở nhà thường loanh quanh 130 trên 80."
                }
            ],
            "evidence_status": "supported",
            "verification_status": "verified",
            "risk_if_wrong": "moderate",
            "requires_doctor_confirmation": false
        },
        {
            "claim_id": "claim_003",
            "section": "S",
            "claim_text": "Không có triệu chứng đau ngực, khó thở, nhức đầu",
            "claim_type": "subjective_history",
            "source_segment_ids": [
                "seg_004"
            ],
            "source_evidence": [
                {
                    "segment_id": "seg_004",
                    "start_time": 16.5,
                    "end_time": 20.0,
                    "quote": "Dạ không. Tôi thấy bình thường, đi bộ tập thể dục cũng không đau ngực."
                }
            ],
            "evidence_status": "supported",
            "verification_status": "verified",
            "risk_if_wrong": "moderate",
            "requires_doctor_confirmation": false
        },
        {
            "claim_id": "claim_004",
            "section": "S",
            "claim_text": "Bệnh nhân phàn nàn bị phù nhẹ ở cổ chân vài tuần nay, thường phù về chiều tối",
            "claim_type": "subjective_history",
            "source_segment_ids": [
                "seg_006"
            ],
            "source_evidence": [
                {
                    "segment_id": "seg_006",
                    "start_time": 26.5,
                    "end_time": 30.0,
                    "quote": "Cổ chân hơi phù đó hả bác sĩ? Tôi thấy cũng bị vài tuần nay, chiều tối là nó sưng lên chút xíu."
                }
            ],
            "evidence_status": "supported",
            "verification_status": "verified",
            "risk_if_wrong": "moderate",
            "requires_doctor_confirmation": false
        },
        {
            "claim_id": "claim_005",
            "section": "S",
            "claim_text": "Ghi nhận tiền sử dị ứng với Penicillin (nổi mề đay, ngứa)",
            "claim_type": "subjective_history",
            "source_segment_ids": [
                "seg_008"
            ],
            "source_evidence": [
                {
                    "segment_id": "seg_008",
                    "start_time": 38.5,
                    "end_time": 44.0,
                    "quote": "tôi uống Penicillin là bị nổi mề đay ngứa ngáy khắp người."
                }
            ],
            "evidence_status": "supported",
            "verification_status": "verified",
            "risk_if_wrong": "moderate",
            "requires_doctor_confirmation": false
        },
        {
            "claim_id": "claim_006",
            "section": "O",
            "claim_text": "Khám lâm sàng phát hiện sưng phù nhẹ ở cổ chân",
            "claim_type": "subjective_history",
            "source_segment_ids": [
                "seg_005"
            ],
            "source_evidence": [
                {
                    "segment_id": "seg_005",
                    "start_time": 20.5,
                    "end_time": 26.0,
                    "quote": "tôi thấy chú bị sưng nhẹ ở cổ chân."
                }
            ],
            "evidence_status": "supported",
            "verification_status": "verified",
            "risk_if_wrong": "moderate",
            "requires_doctor_confirmation": false
        },
        {
            "claim_id": "claim_007",
            "section": "A",
            "claim_text": "Tăng huyết áp nguyên phát, hiện đang kiểm soát tốt",
            "claim_type": "subjective_history",
            "source_segment_ids": [
                "seg_003"
            ],
            "source_evidence": [
                {
                    "segment_id": "seg_003",
                    "start_time": 11.0,
                    "end_time": 16.0,
                    "quote": "Mức 130/80 là đạt mục tiêu rồi chú ạ."
                }
            ],
            "evidence_status": "supported",
            "verification_status": "verified",
            "risk_if_wrong": "moderate",
            "requires_doctor_confirmation": false
        },
        {
            "claim_id": "claim_008",
            "section": "A",
            "claim_text": "Tác dụng phụ phù ngoại biên nghi do Amlodipine",
            "claim_type": "subjective_history",
            "source_segment_ids": [
                "seg_007"
            ],
            "source_evidence": [
                {
                    "segment_id": "seg_007",
                    "start_time": 30.5,
                    "end_time": 38.0,
                    "quote": "Đây có thể là tác dụng phụ của thuốc Amlodipine."
                }
            ],
            "evidence_status": "supported",
            "verification_status": "verified",
            "risk_if_wrong": "moderate",
            "requires_doctor_confirmation": false
        },
        {
            "claim_id": "claim_009",
            "section": "P",
            "claim_text": "Ghi chú dị ứng Penicillin vào hồ sơ y tế",
            "claim_type": "subjective_history",
            "source_segment_ids": [
                "seg_009"
            ],
            "source_evidence": [
                {
                    "segment_id": "seg_009",
                    "start_time": 44.5,
                    "end_time": 52.0,
                    "quote": "Dạ dị ứng Penicillin thì tôi sẽ ghi chú lại vào hồ sơ."
                }
            ],
            "evidence_status": "supported",
            "verification_status": "verified",
            "risk_if_wrong": "moderate",
            "requires_doctor_confirmation": false
        },
        {
            "claim_id": "claim_010",
            "section": "P",
            "claim_text": "Đổi thuốc huyết áp sang Telmisartan để giảm tác dụng phụ phù chân",
            "claim_type": "subjective_history",
            "source_segment_ids": [
                "seg_009"
            ],
            "source_evidence": [
                {
                    "segment_id": "seg_009",
                    "start_time": 44.5,
                    "end_time": 52.0,
                    "quote": "Còn huyết áp thì tôi sẽ đổi sang nhóm Telmisartan để xem chú có đỡ phù chân không nhé."
                }
            ],
            "evidence_status": "supported",
            "verification_status": "verified",
            "risk_if_wrong": "moderate",
            "requires_doctor_confirmation": false
        }
    ]
}